2938967,Санька и Сонька,Костюк М.,-,-,Детская художественная литература,"Проза для детей. Повести, рассказы",Аквилегия-М,-,2022,0+,-,-,806,806,5.0,1,978-5-907377-41-7,"Знаете ли вы, что стрекоза считается самым прожорливым насекомым на Земле? А почему божья коровка так называется? Видели, как танцует пчёлка? Как устроен муравейник? Где у червяка зубы? Как охотится лягушка? Это и многое другое вам расскажут девочка Санька и её подружка кошка Сонька. Небольшие познавательные истории наверняка будут интересны не только детям, но и взрослым. Для дошкольного и младшего школьного возраста.",-,https://img-gorod.ru/29/389/2938967_detail.jpg,64,Мягкая бумажная,25 x 20.3 x 0.9,310,3000,Нет в наличии,-,-,-,-
2937454,Дорога сказок,Савенкова Ф.,-,-,Детская художественная литература,Сказки,RUGRAM_Publishing,-,2022,6+,-,-,809,809,2.0,1,978-5-517-08808-6,"«Ёжик надежды».           I Наводнение разлучило его с семьей. Он едва не погиб. Найдя верных друзей и настоящих врагов, и прошел с ними через многое. Он перевернул этот мир с ног на голову благодаря своей мечте. Он — ёжик надежды. «Мир, которого нет».                                                          Без разницы куда и зачем ползут улитки. Без разницы, взрослый ты или ребенок. Главное, быть собой и не бояться помогать тем, кто слабее и нуждается в твоей помощи. Даже если окружающие не понимают зачем все это нужно и из-за своего непонимания пытаются сделать тебя таким же, как они. «Глициния и кошка». Весной, когда я проснулась, моей кошки рядом не было. Но я верю, что она обязательно вернется, ведь у кошек девять жизней. В каком бы обличье она ни предстала передо мной, она всегда будет самой прекрасной кошкой на свете, исполняющей самые прекрасные колыбельные, способные убаюкать бога.",-,https://img-gorod.ru/29/374/2937454_detail.jpg,142,Твердая бумажная,21.7 x 15.4 x 1.3,280,-,Нет в наличии,-,-,-,-
2938530,Школа юного инженера. Книга по техническому творчеству для детей и взрослых,Галатонова Т.,-,-,Детское творчество и досуг,Другие виды творчества,КТК Галактика,Стань инженером,2022,-,-,-,2114,2114,4.0,1,978-5-6047562-2-5,"У вас в руках вторая книга Галатоновой Татьяны, учителя технологии из Нижнего Новгорода. Первая книга этой серии называется ""Стань инженером"". Обе эти книги помогут вам познавать мир через простые инженерные поделки (мастерилки). Разделы книги: Изобретено в России, Балансиры, Гибкая передача, Рычажные механизмы, Кривошипные механизмы, Механизмы с гидравлическим приводом, Разное. В каждом разделе несколько поделок (мастерилок). Вы узнаете название каждой мастерилки, а также найдете ее краткое описание и область применения, фото конечного результата, QR код, ведущий на видеоролик, список материалов и инструментов, подробную схему - инструкцию сборки. Все инструкции в книге позволяют юному инженеру вносить изменения в конструкцию в зависимости от наличия материалов, инструментов или видения конструкции маленьким автором. Именно это необходимо для развития мышления и творческих способностей. Для родителей и педагогов эта книга станет своеобразным методическим пособием, ведущим, подсказывающим, направляющим.",-,https://img-gorod.ru/29/385/2938530_detail.jpg,136,-,30.5 x 21.7 x 1.8,920,-,Нет в наличии,-,-,-,-
